{
 "table": "air-reinforcement-schedule",
 "sources": [
  "CNA1979:34.84",
  "scan:p142"
 ],
 "notes": [
  "Commonwealth Airplane Reinforcement and Squadron Withdrawal chart, printed as 34.84 (jp2 142). Read twice, from the archive.org scan and the community chart PDFs (Commonwealth Charts.pdf p. 32): 28 entries, 84 cells, 0 differ after normalising spacing and the multiplication sign (some entries print a letter X). No Axis counterpart was found on either source's pages searched.",
  "period as printed; game_turns is the printed Game-Turn or range. A month's aircraft arrive spread as evenly as possible over its four Game-Turns unless the entry names one Game-Turn.",
  "aircraft is the name as printed on this chart; it is not yet keyed to data/tables/aircraft-characteristics.json, whose names are fuller (e.g. B17D here, B-17/D Flying Fortress there).",
  "withdrawals: squadrons removed at the start of the month (the November 1940 entry excepted), each of at least 12 aircraft, from anywhere including Malta and the Commonwealth off-map airfields; role: able to fly combat air patrol (cap), bombing or reconnaissance. Marks: * one of the squadrons must be at least 12 Beaufighters of any mark; ** two squadrons each of at least 12 aircraft able to carry 9 or more bomb points; ‡ one squadron must be of aircraft with 9 or more bomb points; † (both squadrons Beaufighters) is in the key but used by no entry."
 ],
 "rows": [
  {
   "period": "1940, Sept IV (GT 2)",
   "game_turns": {
    "from": 2,
    "to": 2
   },
   "arrivals": [
    {
     "count": 3,
     "aircraft": "Fulmar"
    },
    {
     "count": 2,
     "aircraft": "Hurricane I"
    }
   ],
   "withdrawals": [],
   "sources": [
    "CNA1979:34.84",
    "scan:p142"
   ]
  },
  {
   "period": "Oct I (GT 3)",
   "game_turns": {
    "from": 3,
    "to": 3
   },
   "arrivals": [
    {
     "count": 30,
     "aircraft": "Blenheim I"
    },
    {
     "count": 6,
     "aircraft": "Skua II"
    }
   ],
   "withdrawals": [
    {
     "squadrons": 1,
     "role": "cap"
    }
   ],
   "sources": [
    "CNA1979:34.84",
    "scan:p142"
   ]
  },
  {
   "period": "Nov II (GT 8)",
   "game_turns": {
    "from": 8,
    "to": 8
   },
   "arrivals": [
    {
     "count": 4,
     "aircraft": "B17D"
    }
   ],
   "withdrawals": [
    {
     "squadrons": 2,
     "role": "cap"
    },
    {
     "squadrons": 2,
     "role": "bombing",
     "mark": "**"
    }
   ],
   "sources": [
    "CNA1979:34.84",
    "scan:p142"
   ]
  },
  {
   "period": "Dec I (GT 11)",
   "game_turns": {
    "from": 11,
    "to": 11
   },
   "arrivals": [
    {
     "count": 12,
     "aircraft": "Blenheim IV"
    },
    {
     "count": 40,
     "aircraft": "Wellington I"
    }
   ],
   "withdrawals": [
    {
     "squadrons": 1,
     "role": "bombing"
    }
   ],
   "sources": [
    "CNA1979:34.84",
    "scan:p142"
   ]
  },
  {
   "period": "1941, Jan (GT 15...18)",
   "game_turns": {
    "from": 15,
    "to": 18
   },
   "arrivals": [
    {
     "count": 44,
     "aircraft": "Hurricane I"
    },
    {
     "count": 12,
     "aircraft": "Blenheim I"
    },
    {
     "count": 1,
     "aircraft": "Wellington I"
    }
   ],
   "withdrawals": [
    {
     "squadrons": 1,
     "role": "cap"
    },
    {
     "squadrons": 2,
     "role": "bombing",
     "mark": "**"
    }
   ],
   "sources": [
    "CNA1979:34.84",
    "scan:p142"
   ]
  },
  {
   "period": "Feb (GT 19...22)",
   "game_turns": {
    "from": 19,
    "to": 22
   },
   "arrivals": [
    {
     "count": 30,
     "aircraft": "Hurricane I"
    },
    {
     "count": 24,
     "aircraft": "Blenheim I"
    },
    {
     "count": 14,
     "aircraft": "Blenheim IV"
    },
    {
     "count": 2,
     "aircraft": "Maryland"
    },
    {
     "count": 2,
     "aircraft": "Wellington I"
    }
   ],
   "withdrawals": [
    {
     "squadrons": 1,
     "role": "cap"
    }
   ],
   "sources": [
    "CNA1979:34.84",
    "scan:p142"
   ]
  },
  {
   "period": "Mar (GT 23...26)",
   "game_turns": {
    "from": 23,
    "to": 26
   },
   "arrivals": [
    {
     "count": 14,
     "aircraft": "Blenheim IVF"
    },
    {
     "count": 13,
     "aircraft": "Hurricane I"
    },
    {
     "count": 2,
     "aircraft": "Tomahawk"
    },
    {
     "count": 21,
     "aircraft": "Blenheim I"
    },
    {
     "count": 6,
     "aircraft": "Maryland"
    },
    {
     "count": 6,
     "aircraft": "Lysander"
    },
    {
     "count": 16,
     "aircraft": "Wellington"
    }
   ],
   "withdrawals": [
    {
     "squadrons": 1,
     "role": "bombing"
    }
   ],
   "sources": [
    "CNA1979:34.84",
    "scan:p142"
   ]
  },
  {
   "period": "Apr (GT 27...30)",
   "game_turns": {
    "from": 27,
    "to": 30
   },
   "arrivals": [
    {
     "count": 66,
     "aircraft": "Hurricane I"
    },
    {
     "count": 25,
     "aircraft": "Tomahawk"
    },
    {
     "count": 18,
     "aircraft": "Blenheim I"
    },
    {
     "count": 10,
     "aircraft": "Blenheim IV"
    },
    {
     "count": 6,
     "aircraft": "Maryland"
    },
    {
     "count": 6,
     "aircraft": "Lysander I"
    },
    {
     "count": 13,
     "aircraft": "Wellington I"
    },
    {
     "count": 14,
     "aircraft": "Wellington IV"
    }
   ],
   "withdrawals": [
    {
     "squadrons": 1,
     "role": "cap"
    }
   ],
   "sources": [
    "CNA1979:34.84",
    "scan:p142"
   ]
  },
  {
   "period": "May (GT 31...34)",
   "game_turns": {
    "from": 31,
    "to": 34
   },
   "arrivals": [
    {
     "count": 16,
     "aircraft": "Beaufighter IF"
    },
    {
     "count": 65,
     "aircraft": "Hurricane I"
    },
    {
     "count": 21,
     "aircraft": "Tomahawk"
    },
    {
     "count": 20,
     "aircraft": "Blenheim I"
    },
    {
     "count": 9,
     "aircraft": "Blenheim IV"
    },
    {
     "count": 7,
     "aircraft": "Maryland"
    },
    {
     "count": 15,
     "aircraft": "Wellington IV"
    }
   ],
   "withdrawals": [],
   "sources": [
    "CNA1979:34.84",
    "scan:p142"
   ]
  },
  {
   "period": "Jun (GT 35...38)",
   "game_turns": {
    "from": 35,
    "to": 38
   },
   "arrivals": [
    {
     "count": 5,
     "aircraft": "Beaufighter IF"
    },
    {
     "count": 15,
     "aircraft": "Blenheim IVF"
    },
    {
     "count": 5,
     "aircraft": "Gladiator II"
    },
    {
     "count": 136,
     "aircraft": "Hurricane I"
    },
    {
     "count": 41,
     "aircraft": "Tomahawk"
    },
    {
     "count": 10,
     "aircraft": "Blenheim I"
    },
    {
     "count": 10,
     "aircraft": "Blenheim IV"
    },
    {
     "count": 6,
     "aircraft": "Maryland"
    },
    {
     "count": 12,
     "aircraft": "Lysander I"
    },
    {
     "count": 6,
     "aircraft": "Wellington I"
    }
   ],
   "withdrawals": [
    {
     "squadrons": 1,
     "role": "cap"
    },
    {
     "squadrons": 1,
     "role": "bombing"
    }
   ],
   "sources": [
    "CNA1979:34.84",
    "scan:p142"
   ]
  },
  {
   "period": "Jul (GT 39...42)",
   "game_turns": {
    "from": 39,
    "to": 42
   },
   "arrivals": [
    {
     "count": 3,
     "aircraft": "Gladiator II"
    },
    {
     "count": 32,
     "aircraft": "Hurricane I"
    },
    {
     "count": 20,
     "aircraft": "Tomahawk"
    },
    {
     "count": 15,
     "aircraft": "Wildcat"
    },
    {
     "count": 12,
     "aircraft": "Albacore"
    },
    {
     "count": 35,
     "aircraft": "Blenheim I"
    },
    {
     "count": 50,
     "aircraft": "Blenheim IV"
    },
    {
     "count": 12,
     "aircraft": "Maryland"
    },
    {
     "count": 10,
     "aircraft": "Wellington I"
    },
    {
     "count": 16,
     "aircraft": "Wellington IV"
    }
   ],
   "withdrawals": [
    {
     "squadrons": 1,
     "role": "recon"
    }
   ],
   "sources": [
    "CNA1979:34.84",
    "scan:p142"
   ]
  },
  {
   "period": "Aug (GT 43...46)",
   "game_turns": {
    "from": 43,
    "to": 46
   },
   "arrivals": [
    {
     "count": 4,
     "aircraft": "Beaufighter IF"
    },
    {
     "count": 2,
     "aircraft": "Gladiator II"
    },
    {
     "count": 27,
     "aircraft": "Hurricane I"
    },
    {
     "count": 67,
     "aircraft": "Tomahawk"
    },
    {
     "count": 7,
     "aircraft": "Beaufort I"
    },
    {
     "count": 22,
     "aircraft": "Blenheim I"
    },
    {
     "count": 44,
     "aircraft": "Blenheim IV"
    },
    {
     "count": 30,
     "aircraft": "Maryland"
    },
    {
     "count": 14,
     "aircraft": "Wellington IV"
    }
   ],
   "withdrawals": [
    {
     "squadrons": 1,
     "role": "bombing"
    }
   ],
   "sources": [
    "CNA1979:34.84",
    "scan:p142"
   ]
  },
  {
   "period": "Sep (GT 47...50)",
   "game_turns": {
    "from": 47,
    "to": 50
   },
   "arrivals": [
    {
     "count": 3,
     "aircraft": "Beaufighter IF"
    },
    {
     "count": 13,
     "aircraft": "Blenheim IVF"
    },
    {
     "count": 140,
     "aircraft": "Hurricane I"
    },
    {
     "count": 20,
     "aircraft": "Hurricane IIA"
    },
    {
     "count": 23,
     "aircraft": "Tomahawk"
    },
    {
     "count": 2,
     "aircraft": "Beaufort I"
    },
    {
     "count": 15,
     "aircraft": "Blenheim I"
    },
    {
     "count": 10,
     "aircraft": "Blenheim IV"
    },
    {
     "count": 3,
     "aircraft": "Maryland"
    },
    {
     "count": 13,
     "aircraft": "Wellington IV"
    }
   ],
   "withdrawals": [
    {
     "squadrons": 1,
     "role": "cap",
     "mark": "*"
    }
   ],
   "sources": [
    "CNA1979:34.84",
    "scan:p142"
   ]
  },
  {
   "period": "Oct (GT 51-54)",
   "game_turns": {
    "from": 51,
    "to": 54
   },
   "arrivals": [
    {
     "count": 8,
     "aircraft": "Beaufighter IF"
    },
    {
     "count": 15,
     "aircraft": "Fulmar"
    },
    {
     "count": 81,
     "aircraft": "Hurricane I"
    },
    {
     "count": 16,
     "aircraft": "Tomahawk"
    },
    {
     "count": 3,
     "aircraft": "B17D"
    },
    {
     "count": 3,
     "aircraft": "Beaufort I"
    },
    {
     "count": 10,